{
  "meta": {
    "title": "Folio - Índice de datos",
    "description": "Índice principal con tipos de estudio, convocatorias y datasets temáticos.",
    "version": "2026.05",
    "updatedAt": "2026-05-02T20:22:58.854+02:00"
  },
  "studyTypes": [
    {
      "id": "oposiciones",
      "label": "Oposiciones",
      "temarioTemplate": "oposiciones",
      "convocatoriaId": "uah-2025-c1",
      "questionDatasetIds": [
        "uah-c1-tema-01-constitucion",
        "uah-c1-tema-02-ebep",
        "uah-c1-tema-03-losu",
        "uah-c1-tema-04-lopdgdd",
        "uah-c1-tema-05-discapacidad",
        "uah-c1-tema-06-igualdad",
        "uah-c1-tema-07-prevencion-riesgos-laborales",
        "uah-c1-tema-08-codigo-etico-uah",
        "uah-c1-tema-09-convivencia-uah",
        "uah-c1-tema-10-servicio-biblioteca-uah",
        "uah-c1-tema-11-espacios-equipamiento",
        "uah-c1-tema-12-gestion-coleccion",
        "uah-c1-tema-13-proceso-tecnico",
        "uah-c1-tema-14-identificadores",
        "uah-c1-tema-15-analisis-documental-cdu",
        "uah-c1-tema-16-acceso-abierto-repositorios",
        "uah-c1-tema-17-servicios-usuario",
        "uah-c1-tema-18-prestamo-acceso-documento",
        "uah-c1-tema-19-lsp-descubrimiento",
        "uah-c1-tema-20-cooperacion-bibliotecaria",
        "uah-c1-tema-21-calidad-efqm",
        "uah-c1-tema-22-propiedad-intelectual"
      ]
    },
    {
      "id": "conducir",
      "label": "Carnet de conducir",
      "temarioTemplate": "placeholder",
      "questionDatasetIds": []
    },
    {
      "id": "secundaria",
      "label": "Secundaria / Bachillerato",
      "temarioTemplate": "placeholder",
      "questionDatasetIds": []
    },
    {
      "id": "universidad",
      "label": "Universidad",
      "temarioTemplate": "placeholder",
      "questionDatasetIds": []
    },
    {
      "id": "idiomas",
      "label": "Idiomas",
      "temarioTemplate": "placeholder",
      "questionDatasetIds": []
    },
    {
      "id": "otro",
      "label": "Otro",
      "temarioTemplate": "placeholder",
      "questionDatasetIds": []
    }
  ],
  "convocatorias": [
    {
      "id": "uah-2025-c1",
      "title": "Técnico Auxiliar de Bibliotecas UAH 2025",
      "shortTitle": "UAH 2025 C1",
      "institucion": "Universidad de Alcalá de Henares",
      "cuerpo": "Técnico Auxiliar de Archivos y Bibliotecas (C1)",
      "año": 2025,
      "file": "convocatoria-uah-2025-c1.json",
      "color": "#7c3aed",
      "activa": true,
      "studyType": "oposiciones",
      "questionDatasetIds": [
        "uah-c1-tema-01-constitucion",
        "uah-c1-tema-02-ebep",
        "uah-c1-tema-03-losu",
        "uah-c1-tema-04-lopdgdd",
        "uah-c1-tema-05-discapacidad",
        "uah-c1-tema-06-igualdad",
        "uah-c1-tema-07-prevencion-riesgos-laborales",
        "uah-c1-tema-08-codigo-etico-uah",
        "uah-c1-tema-09-convivencia-uah",
        "uah-c1-tema-10-servicio-biblioteca-uah",
        "uah-c1-tema-11-espacios-equipamiento",
        "uah-c1-tema-12-gestion-coleccion",
        "uah-c1-tema-13-proceso-tecnico",
        "uah-c1-tema-14-identificadores",
        "uah-c1-tema-15-analisis-documental-cdu",
        "uah-c1-tema-16-acceso-abierto-repositorios",
        "uah-c1-tema-17-servicios-usuario",
        "uah-c1-tema-18-prestamo-acceso-documento",
        "uah-c1-tema-19-lsp-descubrimiento",
        "uah-c1-tema-20-cooperacion-bibliotecaria",
        "uah-c1-tema-21-calidad-efqm",
        "uah-c1-tema-22-propiedad-intelectual"
      ],
      "examConfig": {
        "numQuestions": 100,
        "numReserve": 10,
        "durationMinutes": 110,
        "pointsCorrect": 0.6,
        "pointsIncorrect": -0.15,
        "pointsBlank": 0,
        "passingScore": 30,
        "description": "Simulacro oficial: 100 preguntas evaluables más 10 de reserva, 110 minutos, 60 preguntas de primera parte y 40 de segunda parte específica; penalización equivalente a -0,25 respuestas correctas por error y puntuación sobre 60."
      }
    },
    {
      "id": "urjc-2026-c2",
      "title": "Escala Auxiliar Administrativa URJC 2026",
      "shortTitle": "URJC 2026 C2",
      "institucion": "Universidad Rey Juan Carlos",
      "cuerpo": "Escala Auxiliar Administrativa, grupo C, subgrupo C2",
      "año": 2026,
      "file": "convocatoria-urjc-2026-c2.json",
      "color": "#059669",
      "activa": false,
      "hidden": true,
      "studyType": "oposiciones",
      "questionDatasetIds": [
        "constitucion-1978",
        "estatuto-basico-del-empleado-publico-ebep",
        "ley-organica-2-2023-sistema-universitario",
        "ley-organica-3-2018-proteccion-de-datos-personales-y-garantia-de-los-derechos-digitales"
      ]
    },
    {
      "id": "uah-2025-c2",
      "title": "Técnico Auxiliar Administrativa UAH 2025",
      "shortTitle": "UAH 2025 C2",
      "institucion": "Universidad de Alcalá de Henares",
      "cuerpo": "Técnico Auxiliar Administrativa (C2)",
      "año": 2025,
      "file": "convocatoria-uah-2025-c2.json",
      "color": "#f97316",
      "activa": false,
      "hidden": true,
      "studyType": "oposiciones",
      "questionDatasetIds": [
        "constitucion-1978",
        "estatuto-basico-del-empleado-publico-ebep",
        "ley-organica-2-2023-sistema-universitario",
        "ley-40-2015-regimen-juridico-sector-publico",
        "ley-organica-3-2018-proteccion-de-datos-personales-y-garantia-de-los-derechos-digitales",
        "ley-31-1995-prevencion-de-riesgos-laborales",
        "normativa-gestion-economica-y-presupuestaria-uah",
        "ley-53-1984-incompatibilidades",
        "ley-9-2017-contratos-del-sector-publico"
      ]
    }
  ],
  "datasets": [
    {
      "id": "constitucion-1978",
      "title": "Constitución Española 1978",
      "description": "Preguntas y flashcards organizadas por títulos y capítulos de la Constitución.",
      "file": "db-constitucion.json",
      "tag": "Constitución",
      "color": "#1d4ed8",
      "officialUrl": "https://www.boe.es/eli/es/c/1978/12/27/(1)/con"
    },
    {
      "id": "estatuto-basico-del-empleado-publico-ebep",
      "title": "Estatuto Básico del Empleado Público (EBEP)",
      "description": "Preguntas y flashcards basadas en el Texto Refundido de la Ley del EBEP.",
      "file": "db-estatuto-basico-del-empleado-publico-EBEP.json",
      "tag": "EBEP",
      "officialUrl": "https://www.boe.es/eli/es/rdlg/2015/10/30/5/con",
      "resources": [
        {
          "type": "pdf",
          "title": "Texto refundido consolidado (BOE)",
          "path": "data/general/02_Estatuto_Basico_del_Empleado_Publico.pdf"
        },
        {
          "type": "md",
          "title": "Texto en Markdown (para lectura rápida)",
          "path": "data/general/02_Estatuto_Basico_del_Empleado_Publico.md"
        }
      ]
    },
    {
      "id": "ley-organica-2-2023-sistema-universitario",
      "title": "Ley Orgánica 2/2023 del Sistema Universitario (LOSU)",
      "description": "Preguntas y flashcards basadas en la Ley Orgánica 2/2023, de 22 de marzo, del Sistema Universitario.",
      "file": "db-ley-organica-2-2023-sistema-universitario.json",
      "tag": "LOSU",
      "officialUrl": "https://www.boe.es/eli/es/lo/2023/03/22/2/con"
    },
    {
      "id": "ley-19-2013-transparencia",
      "title": "Ley 19/2013 de Transparencia",
      "description": "Texto y recursos de la Ley 19/2013, de 9 de diciembre, de transparencia, acceso a la información pública y buen gobierno.",
      "file": "db-ley-19-2013-transparencia.json",
      "tag": "Transparencia",
      "officialUrl": "https://www.boe.es/eli/es/l/2013/12/09/19"
    },
    {
      "id": "ley-organica-3-2018-proteccion-de-datos-personales-y-garantia-de-los-derechos-digitales",
      "title": "Ley Orgánica 3/2018, de Protección de Datos Personales y garantía de los derechos digitales (LOPDGDD)",
      "description": "Dataset placeholder para futuras preguntas sobre la LOPDGDD.",
      "file": "db-ley-organica-3-2018-proteccion-de-datos-personales-y-garantia-de-los-derechos-digitales.json",
      "tag": "LOPDGDD",
      "officialUrl": "https://www.boe.es/eli/es/lo/2018/12/05/3/con"
    },
    {
      "id": "ley-40-2015-regimen-juridico-sector-publico",
      "title": "Ley 40/2015, de Régimen Jurídico del Sector Público",
      "description": "Preguntas y flashcards basadas en la Ley 40/2015, de 1 de octubre, de Régimen Jurídico del Sector Público.",
      "file": "db-ley-40-2015-regimen-juridico-sector-publico.json",
      "tag": "Ley 40/2015",
      "officialUrl": "https://www.boe.es/eli/es/l/2015/10/01/40/con"
    },
    {
      "id": "ley-31-1995-prevencion-de-riesgos-laborales",
      "title": "Ley 31/1995, de 8 de noviembre, de Prevención de Riesgos Laborales",
      "description": "Preguntas y flashcards sobre la Ley 31/1995, de Prevención de Riesgos Laborales.",
      "file": "db-ley-31-1995-prevencion-de-riesgos-laborales.json",
      "tag": "Ley 31/1995",
      "officialUrl": "https://www.boe.es/eli/es/l/1995/11/08/31/con"
    },
    {
      "id": "normativa-gestion-economica-y-presupuestaria-uah",
      "title": "Normativa de Gestión Económica y Presupuestaria (UAH)",
      "description": "Normativa de Gestión Económica y Presupuestaria de la Universidad de Alcalá (Capítulo IV).",
      "file": "db-normativa-de-gestion-economica-y-presupuestaria-uah.json",
      "tag": "UAH",
      "officialUrl": "https://www.uah.es/es/conoce-la-uah/organizacion-y-gobierno/servicios-universitarios/servicio-de-contratacion/#normativa-de-la-uah"
    },
    {
      "id": "ley-53-1984-incompatibilidades",
      "title": "Ley 53/1984, de Incompatibilidades del personal al servicio de las Administraciones Públicas",
      "description": "Dataset placeholder para la Ley 53/1984 sobre incompatibilidades del personal al servicio de las Administraciones Públicas.",
      "file": "db-ley-53-1984-incompatibilidades.json",
      "tag": "Ley 53/1984",